{
  "caseDetails": {
    "originatingOrganisation": "B01NM00",
    "cpsOrganisation": "A30AB00",
    "otherPartyOfficerInCase": {
      "personalInformation": {
        "address": {
          "address1": "101",
          "address2": "56Police House",
          "address3": "Letsby Avenue",
          "address4": "Avon",
          "postcode": "HA1 2ER"
        },
        "contactDetails": {
          "primaryEmail": "vegaoic@test.dom",
          "work": "0117911911"
        },
        "firstName": "Vega",
        "lastName": "OIC",
        "title": "Baron"
      },
      "policeOfficerRank": "Constable"
    },
    "summonsCode": "SUMMONS_CODE",
    "caseId": "CASE-ID",
    "initiationCode": "S",
    "prosecutorCaseReference": "CASE-URN",
    "caseMarkers": [{
      "markerTypeCode": "ABC",
      "markerTypeDescription": "Child Abuse",
      "markerTypeId": "2013c181-7458-4fb2-a637-b596fbe0e781"
    }],
    "prosecutor": {
      "informant": "informant",
      "prosecutingAuthority": "B01NM00"
    }
  },
  "defendants": [
    {
      "id": "DEFENDANT_ID1",
      "documentationLanguage": "E",
      "hearingLanguage": "W",
      "initialHearing": {
        "courtHearingLocation": "C55BN00",
        "dateOfHearing": "2050-02-04",
        "timeOfHearing": "09:05:01.001"
      },
      "individual": {
        "personalInformation": {
          "title": "Baron",
          "firstName": "John",
          "lastName": "Smith",
          "occupation": "Software Developer",
          "occupationCode": 43,
          "address": {
            "address1": "66 Exeter Street",
            "address2": "line 2",
            "address3": "line 3",
            "address4": "line 4",
            "address5": "line 5",
            "postcode": "M60 1NW"
          },
          "contactDetails": {
            "work": "020111222",
            "home": "020111223",
            "mobile": "07572222943",
            "primaryEmail": "scrooge.mcduck@mail.com",
            "secondaryEmail": "scrooge.mcduck2@mail.com"
          }
        },
        "selfDefinedInformation": {
          "gender": "MALE"
        }
      },
      "offences": [
        {
          "offenceId": "032575aa-85e7-11e9-bc42-526af7764f64",
          "offenceCode": "OFCODE12",
          "offenceSequenceNumber": 1,
          "offenceCommittedDate": "2018-09-10",
          "offenceCommittedEndDate": "2018-10-10",
          "offenceDateCode": 1,
          "offenceLocation": "Croydon",
          "offenceWording": "TV Licence not paid",
          "arrestDate": "2015-03-03",
          "appliedCompensation": 200,
          "alcoholRelatedOffence": {
            "alcoholLevelMethod": "A",
            "alcoholLevelAmount": 100
          }
        }
      ],
      "postingDate": "2018-09-10"
    }
  ],
  "channel": "CHANNEL_TYPE",
  "externalId": "EXTERNAL_ID",
  "isCivil": true
}