{
  "caseDetails": {
    "originatingOrganisation": "B01NM00",
    "cpsOrganisation": "A30AB00",
    "caseId": "CASE-ID",
    "initiationCode": "Q",
    "prosecutorCaseReference": "CASE-URN",
    "prosecutor": {
      "informant": "informant",
      "prosecutingAuthority": "prosAut"
    }
  },
  "defendants": [
    {
      "id": "DEFENDANT_ID1",
      "aliasForCorporate": [
        "FakeCompany",
        "RealCompany"
      ],
      "documentationLanguage": "W",
      "hearingLanguage": "W",
      "initialHearing": {
        "courtHearingLocation": "C55BN00",
        "dateOfHearing": "2050-02-04",
        "timeOfHearing": "09:05:01.001"
      },
      "organisationName": "Ministry of Justice",
      "selfDefinedEthnicity": "W1",
      "offences": [
        {
          "offenceCode": "OFCODE12",
          "offenceId": "OFFENCE_ID1",
          "offenceSequenceNumber": 1,
          "offenceCommittedDate": "2018-09-10",
          "offenceDateCode": 1,
          "offenceLocation": "Croydon",
          "offenceWording": "TV Licence not paid",
          "chargeDate": "2019-01-10",
          "alcoholRelatedOffence": {
            "alcoholLevelMethod": "A",
            "alcoholLevelAmount": 100
          }
        }
      ],
      "postingDate": "2018-09-10"
    }
  ],
  "channel": "SPI",
  "externalId": "EXTERNAL_ID"
}