{
  "caseDetails": {
    "initiationCode": "O",
    "prosecutor": {
      "prosecutingAuthority": "prosAut"
    },
    "originatingOrganisation": "GAFTL00",
    "dateReceived": "DATE_RECEIVED"
  },
  "defendants": [
    {
      "id": "DEFENDANT_ID1",
      "custodyStatus": "B",
      "individual": {
        "personalInformation": {
          "address": {
            "address1": "340",
            "address2": "8009 Camden Throughway",
            "postcode": "SW11 1JU"
          },
          "title": "Mr",
          "firstName": "TyshawnTEST",
          "lastName": "O'Reilly"
        },
        "selfDefinedInformation": {
          "dateOfBirth": "2050-02-04",
          "gender": "NOT_SPECIFIED",
          "nationality": "ZZZ"
        },
        "parentGuardianInformation": {
          "dateOfBirth": "2050-02-04",
          "gender": "MALE"
        }
      },
      "documentationLanguage": "E",
      "hearingLanguage": "E",
      "offences": [
        {
          "offenceCode": "OFCODE12",
          "offenceId": "2013c181-7458-4fb2-a637-b596fbe0e792",
          "offenceSequenceNumber": 1,
          "offenceCommittedDate": "2018-09-10",
          "offenceCommittedEndDate": "2018-10-10",
          "offenceDateCode": 1,
          "offenceLocation": "Croydon",
          "offenceWording": "TV Licence not paid",
          "arrestDate": "2015-03-04",
          "appliedCompensation": 200,
          "alcoholRelatedOffence": {
            "alcoholLevelMethod": "A",
            "alcoholLevelAmount": 100
          }
        }
      ],
      "initialHearing": {
        "hearingDuration": 20,
        "hearingLanguage": "E",
        "dateOfHearing": "2020-01-01",
        "timeOfHearing": "11:11:00.000",
        "courtHearingLocation": "BADLOC",
        "roomId": "9e4932f7-97b2-3010-b942-ddd2624e4dd8"
      },
      "prosecutorDefendantReference": "DEFENDANT_REFERENCE1"
    }
  ],
  "channel": "CIVIL",
  "isCivil": true
}
