{
  "caseDetails":{
    "caseId":"CASE-ID",
    "initiationCode":"J",
    "prosecutorCaseReference":"nPGQG9oQw3",
    "originatingOrganisation":"GAEAA01",
    "cpsOrganisation": "A30AB00",
    "prosecutor":{
      "prosecutingAuthority":"GAEAA01",
      "informant":"Venu"
    }
  },
  "defendants":[
    {
      "asn":"asn",
      "documentationLanguage":"E",
      "hearingLanguage":"E",
      "id":"cc71424a-cc98-4dda-828f-eb3e31b075c8",
      "individual":{
        "driverNumber":"AS",
        "nationalInsuranceNumber":"SN123456C",
        "personalInformation":{
          "address":{
            "address1":"Address Line 1",
            "address2":"Address Line 2",
            "address3":"Address Line 3",
            "address4":"Address Line 4",
            "address5":"Address Line 5",
            "postcode":"CR0 1XX"
          },
          "contactDetails":{
            "home":"9991231230",
            "mobile":"9991231230",
            "primaryEmail":"abc@test.com",
            "secondaryEmail":"abc@test.com",
            "work":"9991231230"
          },
          "firstName":"Steve  nothing",
          "lastName":"Reaper",
          "occupation":"TA",
          "occupationCode":666,
          "title":"Baron"
        },
        "selfDefinedInformation":{
          "additionalNationality":"GBR",
          "dateOfBirth":"1999-09-09",
          "ethnicity":"W1",
          "gender":"MALE",
          "nationality":"POL"
        }
      },
      "languageRequirement":"Test no special language needs",
      "numPreviousConvictions":9,
      "offences":[
        {
          "appliedCompensation":0.00,
          "backDuty":0.00,
          "backDutyDateTo":"2019-12-04",
          "chargeDate":"2019-12-04",
          "offenceCode":"CA03013",
          "offenceCommittedDate":"2019-11-04",
          "offenceCommittedEndDate":"2019-12-04",
          "offenceDateCode":4,
          "offenceId":"0572d1d1-97ff-4eb8-87da-601334d543d6",
          "offenceLocation":"Croydon",
          "offenceSequenceNumber":1,
          "offenceWording":"Test Prosecution charge wording",
          "offenceWordingWelsh":"Test Prosecution charge wording in Welsh",
          "statementOfFacts":"Test Prosecution statements of facts"
        }
      ],
      "postingDate":"2019-12-04",
      "prosecutorDefendantReference":"397e6282-21b7-4220-aa75-102dd4569111",
      "specificRequirements":"Test no special needs",
      "appliedProsecutorCosts":20.99
    }
  ],
  "channel":"CPPI",
  "externalId": "EXTERNAL_ID"
}
