{
  "caseDetails": {
    "originatingOrganisation": "B01NM00",
    "cpsOrganisation": "A30AB00",
    "otherPartyOfficerInCase": {
      "personalInformation": {
        "address": {
          "address1": "101",
          "address2": "56Police House",
          "address3": "Letsby Avenue",
          "address4": "Avon",
          "postcode": "HA1 2ER"
        },
        "contactDetails": {
          "primaryEmail": "vegaoic@test.dom",
          "work": "0117911911"
        },
        "firstName": "Vega",
        "lastName": "OIC",
        "title": "Baron"
      },
      "policeOfficerRank": "Constable"
    },
    "caseId": "CASE-ID",
    "initiationCode": "Q",
    "prosecutorCaseReference": "CASE-URN",
    "prosecutor": {
      "informant": "informant",
      "prosecutingAuthority": "prosAut"
    }
  },
  "defendants": [
    {
      "id": "DEFENDANT_ID1",
      "prosecutorDefendantReference": "DEFENDANT_REFERENCE1",
      "documentationLanguage": "W",
      "hearingLanguage": "W",
      "custodyStatus": "B",
      "numPreviousConvictions": 3,
      "initialHearing": {
        "courtHearingLocation": "C55BN00",
        "dateOfHearing": "2050-02-04",
        "timeOfHearing": "09:05:01.001"
      },
      "individual": {
        "personalInformation": {
          "title": "Baron",
          "firstName": "John",
          "lastName": "Smith",
          "occupation": "Software Developer",
          "occupationCode": 43,
          "address": {
            "address1": "66 Exeter Street",
            "address2": "line 2",
            "address3": "line 3",
            "address4": "line 4",
            "address5": "line 5",
            "postcode": "M60 1NW"
          },
          "contactDetails": {
            "work": "020111222",
            "home": "020111223",
            "mobile": "07572222943",
            "primaryEmail": "scrooge.mcduck@mail.com",
            "secondaryEmail": "scrooge.mcduck2@mail.com"
          }
        },
        "selfDefinedInformation": {
          "gender": "MALE"
        },
        "parentGuardianInformation": {
          "selfDefinedEthnicity": "W1",
          "observedEthnicity": "1",
          "gender": "MALE",
          "dateOfBirth": "2015-04-04",
          "personalInformation": {
            "lastName": "Brown"
          }
        }
      },
      "offences": [
        {
          "offenceCode": "OFCODE12",
          "offenceId": "OFFENCE_ID1",
          "offenceSequenceNumber": 1,
          "offenceCommittedDate": "2018-09-10",
          "offenceCommittedEndDate": "2018-10-10",
          "offenceDateCode": 1,
          "offenceLocation": "Croydon",
          "offenceWording": "TV Licence not paid",
          "chargeDate": "2019-01-10",
          "appliedCompensation": 200,
          "alcoholRelatedOffence": {
            "alcoholLevelMethod": "A",
            "alcoholLevelAmount": 100
          },
          "vehicleRelatedOffence": {
            "vehicleCode": "O",
            "vehicleRegistrationMark": "AA11 ABC"
          }
        }
      ],
      "postingDate": "2018-09-10"
    },
    {
      "id": "DEFENDANT_ID2",
      "prosecutorDefendantReference": "DEFENDANT_REFERENCE2",
      "individualAliases": [
        {
          "title": "Baron",
          "firstName": "John",
          "givenName2": "James",
          "givenName3": "Jerry",
          "lastName": "Smith"
        },
        {
          "title": "Baroness",
          "firstName": "John",
          "lastName": "Smith"
        }
      ],
      "documentationLanguage": "W",
      "hearingLanguage": "W",
      "custodyStatus": "B",
      "initialHearing": {
        "courtHearingLocation": "C55BN00",
        "dateOfHearing": "2050-02-04",
        "timeOfHearing": "09:05:01.001"
      },
      "individual": {
        "personalInformation": {
          "title": "Baron",
          "firstName": "John",
          "lastName": "Smith",
          "address": {
            "address1": "armagaddon house",
            "postcode": "M60 1NW"
          },
          "contactDetails": {}
        },
        "selfDefinedInformation": {
          "gender": "MALE"
        }
      },
      "offences": [
        {
          "offenceCode": "OFCODE12",
          "offenceId": "OFFENCE_ID2",
          "offenceSequenceNumber": 1,
          "offenceCommittedDate": "2018-09-10",
          "offenceCommittedEndDate": "2018-10-10",
          "offenceDateCode": 1,
          "offenceLocation": "Croydon",
          "offenceWording": "TV Licence not paid",
          "chargeDate": "2019-01-10",
          "appliedCompensation": 200,
          "alcoholRelatedOffence": {
            "alcoholLevelMethod": "A",
            "alcoholLevelAmount": 100
          },
          "vehicleMake": "Toyota",
          "vehicleRegistrationMark": "BB11 ABC"
        }
      ],
      "postingDate": "2018-09-10"
    }
  ],
  "channel": "SPI",
  "externalId": "EXTERNAL_ID"
}
