{
  "caseDetails": {
    "caseId": "${case.id}",
    "prosecutorCaseReference": "${case.urn}",
    "originatingOrganisation": "123",
    "cpsOrganisation": "A30AB00",
    "initiationCode": "J",
    "prosecutor": {
      "prosecutingAuthority": "GAEAA01",
      "informant": "Adam"
    }
  },
  "defendants": [
    {
      "id": "${defendant.id}",
      "appliedProsecutorCosts": 200,
      "documentationLanguage": "W",
      "hearingLanguage": "W",
      "individual": {
        "personalInformation": {
          "title": "Baron",
          "firstName": "John",
          "lastName": "Smith",
          "address": {
            "address1": "armagaddon house",
            "postcode": "M60 1NW"
          },
          "contactDetails": {
            "home": "0207 000 0000",
            "mobile": "11111 111 111",
            "primaryEmail": "primary@email.com",
            "secondaryEmail": "secondary@email.com",
            "work": "0207 111 1111"
          }
        },
        "selfDefinedInformation": {
          "ethnicity": "W1",
          "gender": "MALE",
          "dateOfBirth": "${defendant.dob:-1990-01-01}",
          "nationality": "${defendant.nationality:-GBR}"
        },
        "nationalInsuranceNumber": "AB123456C"
      },
      "offences": [
        {
          "offenceCode": "${offence1.code:-OFCODE12}",
          "offenceSequenceNumber": 1,
          "offenceCommittedDate": "${offence1.committedDate:-2017-11-10}",
          "offenceDateCode": 1,
          "offenceWording": "TV Licence not paid",
          "chargeDate": "${offence1.chargeDate:-2018-02-01}",
          "appliedCompensation": 200,
          "alcoholRelatedOffence": {
            "alcoholLevelMethod": "${offence1.alcoholRelatedOffence.alcoholLevelMethod:-A}",
            "alcoholLevelAmount": 100
          }
        },
        {
          "offenceCode": "${offence2.code:-OFCODE12}",
          "offenceSequenceNumber": 2,
          "offenceCommittedDate": "${offence2.committedDate:-2017-11-10}",
          "offenceDateCode": 1,
          "offenceWording": "TV Licence not paid",
          "chargeDate": "${offence2.chargeDate:-2018-02-01}",
          "appliedCompensation": 200,
          "alcoholRelatedOffence": {
            "alcoholLevelMethod": "${offence2.alcoholRelatedOffence.alcoholLevelMethod:-A}",
            "alcoholLevelAmount": 100
          }
        }
      ],
      "postingDate": "2018-09-10"
    }
  ],
  "channel": "CPPI",
  "externalId": "${external.id}"
}